date,title_es,translation,summary,sentiment label,sentiment score
12-31-2022,"Libros para salvar el planeta
","Faced with the feeling of defeat in the face of the collapse, various authors propose solutions that go through both direct action and the search for symbolic elements that challenge the collective consciousness The choice of the term was not something premeditated, but rather something of the “burning of the moment”. And that to the hair came, of course, the choice of the word “burn”. The year was 2000 and Paul J. Crutzen, Nobel Prize in Chemistry of 1995, participated in a conference when someone brought up the expression “Holocene”, the denomination that receives the geological period that began just under 10,000 years ago, starting from the end of the last glaciation. Convinced that that voice referring to a relatively warm-temperature Earth in which Homo sapiens thrived was no longer useful to designate the world that inhabited, Crutzen resorted to a term that since then has not stopped winning wholes: “Now we live in the Anthropocene!” That is, the age of mastery of the human being. In these two decades long since the anecdote, that intuition has been consolidated as a palpable reality, an eventuality that—literally—can be seen and felt. We people had never exercised such a degree of influence and domination over the planet. We have consolidated ourselves as a force of nature with the ability to create, but perhaps, above all, in the spirit of destruction. And the world goes to hell. You just need to look out there, through the house window or through the window of the screen. This is reflected in the countless dystopias we consume in series and films, which we read in novels and which are broadcast on television 24 hours a day, including, with their patina of cheesy optimism, the stellar Christmas announcements. The resources are depleted, the climate is destabilized, the system is collapsing, civilization is breaking down. The outlook is as frightening as it is exhausting. Planting in the face of the feeling of impotence that produces such a flood of fatalities, numerous authors and researchers have gone out for solutions. Not only do they propose measures of direct action, but they also encourage the search for symbolic elements capable of challenging the collective consciousness. Here, a brief sample of entries from a dictionary of terms for the reconstruction of the planet collected from a selection of recent essays. Acceptance. After denial, anger, negotiation and depression, mourning, they say, reaches its definitive stage with acceptance. The alphabetical order, however, requires that this voice be placed not the last one, but the first one on the list. Seneca said that “the increases are slow growing, but the road to ruin is fast,” and now Professor Ugo Bardi points out to him in Before the Collapse (Catarata) that, since every outcome is inevitable, if you have to collapse, at least let’s do it right. Or, what is the same thing, that we accept reality and proceed to organize ourselves. Specialist in complex systems, the Italian researcher argues that, while the current crisis does not have to mean the end of the world, it could mean the end of the world as we know it. Among the few good news that Bardi carries is the idea that any collapse is followed by a rebound. But would this be possible, the author asks, “in a world exhausted, in terms of mineral resources, and subject to great damage to ecosystems”? The answer: “A civilization of complexity comparable to ours cannot exist without access to a comparable energy flow.” And some possible alternatives for comfort: renewables, silicon, space travel. From the starting point of a dwindling humanity (if not missing), Islas del Abandonación (Captain Swing), from Cal Flyn, opens another loophole to hope. Through the pages, the author travels to landscapes of disaster all over the world—from Chernobyl to Detroit, from mountains of debris in Scotland known as the Five Sisters to the rotting sea of Salton in California—where nature has been able to reborn in unexpected ways at times. Food. Our voracious hunger is leaving the planet in the bones. Just as we consume uncontrolled clothing, we have engaged in cheap but unsustainable food that is not only harmful to the environment, but also to health. In Sitopia (Captain Swing), architect Carolyn-Steel (author of Hungry Cities, where she highlights the crucial relationship of dependence between what we eat and where we live) argues that food “can be the most powerful means we have to think and act together to create a better world.” Not in vain, our lives depend, and very directly, on it. In her essay, the British author explores not only the political and social power of food, but also the options they offer to reconnect with others and with the environment. Other titles, like And Now What Do We Eat? (Peninsula), by former food industry worker Christophe Brusset, draw a detailed map of the supermarket corridors to find the most direct path to health and sustainability in the middle of a jungle populated with junk food. In a long time ago we ate animals (Destiny), anthropologist Roanne Van Voorst enters into a technological and exclusively vegan future, a philosophy of life that does not fail to gain followers since it not only pursues sustainability, but also health and respect for other sentient beings. Anticapitalism. It is not clear whether it was Fredric Jameson or Slavoj Žižek who first uttered that round phrase that says it is “easier to imagine the end of the world than the end of capitalism,” but the truth is that more and more authors are trying to refute it. The impossible aspiration of unlimited growth, destructive consumerism, unbridled precariousness and the inequality of colossal proportions... It is obvious that the system is straining its limits beyond reasonableness and so certifies an increasing number of books that bet on the search for substitutes for the current socio-economic model, to which journalist Naomi Klein has already accused with all luxury of proof in her monumental This changes everything (Planet) of having positioned itself as the number one enemy of the environment. Capitalism or the planet (Errata Naturae), by Frédéric Lordon, defends pragmatism against idealism and proposes a way out through alliance with other movements such as anti-racism. How to dynamite a pipeline (Errata Naturae), by Andreas Malm, interrelates environmental militancy with anti-capitalism and the fight against fossil fuels, which are largely responsible for the climate crisis. Detachment from possessions, comforts, and privileges will undoubtedly be a daunting task. In Learning to live and die in the Anthropocene (Errata Naturae), Roy Scranton reflects on what it means to pass through the end of an era and brings out what philosophy—from stoic thought to humanism that connects us with others—can contribute to free us from our dependencies. The Ecology of Freedom (Captain Swing), by Murray Bookchin, advocates replacing the hierarchical structures of capitalism with horizontal organization. And in The Nature Against Capital (Bellaterra), Kohei Saito argues that the anti-ecologism that Marx has traditionally been accused of for his aspiration to continuous growth is in fact the result of a misunderstanding. On the contrary, the author stresses, the protection of the environment beats at the heart of the alternative proposed by socialism. Art. The list of calamities overflying the planet is extensive, and the ability of art to take sides, reduced. Or maybe not so much? Beyond the wake-up calls of various environmental groups based on spilling liquids on paintings, the French critic and curator Paul Ardenne exhibits in An ecological art. Plastic Creation and Anthropocene (Adriana Hidalgo) a compendium of creations that, while not offering solutions in terms of concrete effectiveness, do exert an influence in the sphere of symbolic. The artivists, as the activist artists were baptized, transport their ecological commitment to the field of representation. They produce material from ideas. And those notions are transmitted through his works to make the leap to reality. Concrete examples? The book brings dozens of case studies: it begins with classics such as Robert Smithson's Land Art sculptures and Joseph Beuys' environmental performances in the 20th century and moves towards contemporary proposals such as Olafur Eliasson's awareness projects and Jérémy Gobé's biomimetic corals. Awareness. Despite the unanimity of scientific arguments, there is still a huge burden of disinformation around the global ecological crisis. So much so that there are even those who deny it, not to mention the many others who ignore it, or ignore it. In Colapsology (Arpa), French researchers Pablo Servigne and Raphaël Stevens took stock of catastrophes and updated solutions, shaping a book that became a sort of introductory manual, a starting point from which to address the dangerous issue of cataclysm. Later, the authors joined biologist Gaultier Chapelle in Another End of the World is possible (Arpa), where from the basis of collapse, i.e., the study of collapse, they broaden the outlook for collapse, a philosophy of collapse capable of propelling optimism in the face of the feeling of defeat. Your recipe: realizable answers to difficult questions, such as the search for meaning in a declining world, the relevance of moving forward, and the need to create bonds to combat selfishness. Decretion. If we add finite resources to the desire for inexhaustible expansion, there is no way to square the accounts. The solution? Subtract. In Decretion. A reasoned proposal (Alianza), the former university professor Carlos Taibo starts from an image that invites to reposition the scales: in Spain, he explains, the ecological footprint is above 3, which means that “to maintain the existing economic activities it is necessary to have a territory at least three times greater than that available”. After more than a decade of study and dissemination, the author gathers and justifies the conclusions he has reached on what really implies to decrease and why it is inescapable to get to work. Taibo, defender of anarchism and self-management, has an even more recent title, Ecofascism (Catarata), where he warns of the commitment to ecology that comes from the side of certain powerful, who, aware of the serious crisis that is going through the planet, strive to preserve resources, but only for the enjoyment of a few. Spirituality. Since René Descartes bequeathed to posterity his well-known “Cogito, ergo sum”, European thought and, with it, the global has been dragged by the implicit belief that only reason and logic govern the universe. Intuition and mysticism have been relegated to the realm of superstory, but more and more voices are rising up against the tyranny of mathematics. Princess of Asturias Award of Social Sciences 2017, the British Karen Armstrong has translated into Sacred Nature (Critic) an enlightening claim to regain the link with the natural world. Expert in religions (she was a nun for seven years), she concentrates on Chinese and Indian traditions as exponents of a philosophical current that not only respects but venerates nature. “It’s not about believing or not believing in this or that religious doctrine,” he says, “but about incorporating into our lives a series of perceptions and practices that have the right potential to transform our minds and hearts.” In Ecotopia (Anagrama), the author, art historian and yoga teacher Alexis Racionero Rague travels through the flow of schools, myths and authors ——from shamanism to utopian socialism; from the Walker before a sea of fog, from Friedrich, who marvels at the immensity of the landscape, to the comforting asceticism of the Walden of Thoreau — to lead to a founding decalogue of ecotopia, a utopia beyond ecology that allows us to “connect more deeply with the wisdom of the Earth to establish a new relationship with it”. And in Essential Nature (Atalanta), the philosopher Christian of Quincey recalls that the notion of a living universe, of “intrinsically sentient matter”, has been a continuum throughout the history of Western thought, only recently interrupted. The lack of consideration for the world that nourishes and envelops us, sums up the thinker, is but an anomaly of our time. Reorganization. A few years ago, the late biologist Edward O. Wilson — nicknamed the “father of biodiversity” — launched an extreme proposal to reverse the extinction of animal and plant species: to reduce human presence to half the planet, leaving the other half available to nature. After that theory, a call to open our eyes presented in the book Middle Planet (Errata Naturae), other authors have continued to raise ideas on how to organize ourselves, many certainly less daring, but perhaps more feasible, at least in the short term. From an official pragmatism, with information gathered from surveys, interviews and research, ex-adviser of Obama Beth Simone Noveck has developed in How to Solve Public Problems (Galaxia Gutenberg) a catalogue of measures to reconfigure the public square of democracy with the help of social networks and digital technology. Within its 2030 City collection, the Catarata publishing house offers in titles such as circular, cohesive and creative Cities, edited by María Jesús Monteagudo, Nerea Aranbarri and Basagaitz Guereño, reflections on how cities can contribute to sustainable human development through the promotion of recycling, autonomy and the empowerment of talent. Mental health. We need to talk about “this-that-us-is-going.” Surely many will not be able to define it accurately, it is a gray heaviness that is sometimes perceived as a black cloud or a white noise. But there he is, always stalking. Undefined malaise, associated with precarious mental health, from which today few, almost no one, can escape. If there were not enough reasons for concern in this late-capitalist society, now comes the eco-anxiety—the anguish at the imminence of cataclysm—to sneak into our heads. In And Now I What I Do (Captain Swing), Andreu Escrivà applies, without sermons, the maxim that affirms that change begins with oneself. In order to overcome the crisis, the author urges us to take action on the matter. Among the commandments he proposes to address the climate emergency and, by the way, to improve our psychological well-being are ideas as basic and necessary as dismantling the excuses with which we justify our passivity. In parallel, the ambientologist develops a decalogue of imperatives, with actions ranging from the “run” and the “exige” to the “imagina” and, above all, the “we do”. You can follow BABELIA on Facebook and Twitter, or sign up here to receive our weekly newsletter.","The Anthropocene is the age of mastery of the human being. Faced with the feeling of defeat in the face of the collapse, various authors propose solutions that go through both direct action and the search for symbolic elements that challenge the collective consciousness The choice of the term was not something premeditated, but rather something of the “burning of the moment”.",NEU,0.933057963848114
12-31-2022,"Las ‘bestas’ de San Francisco: el millonario que encerró la casa de su vecino en una verja de 13 metros de altura
","The numantine resistance of a humble inhabitant in a Californian neighborhood of new rich people curbed, in 1876, the real estate plans of tycoon Charles Crocker, who, after several attempts to demotivate his rival, decided to surround his house with a wooden fence Fear of neighbor and other nearby predators is not out of fashion: there is As bestas, nominated for 17 Goya Awards and inspired by real events, which deals exactly with this topic. But there is another case, earlier and further away, in which this fear was translated into architectural delirium. The story begins with Nicholas Yung, a man who in 1876 got involved in the real estate plans of tycoon Charles Crocker. Born in Germany, Yung had migrated in 1848 to the United States in search of opportunities. And he found them. After years of effort and hard work, he gathered enough wealth to start one of those businesses in San Francisco that always have a future: a funeral home. Thanks to her, she was able to move along with his wife Roseta to a small parkelite on top of California Street Hill (at the intersection with Powell Street), where a little house with a garden was built that also had enviable views, with the Golden Gate to the north, San Francisco Bay to the east and the city to the south. So attractive was that area that soon more wealthy people would be interested in it. Charles Crocker (1822 – 1888) had made his fortune at the expense of foreign labor and very cheap, as one of the four major investors in the railway giant Central Pacific Railroad, when the trains were to be the next major American industry. After that, his partners and he thought that a good place to build the most exclusive homes of San Francisco was that hill, because of its panorama, the tranquility it offered, the proximity to the financial city and the connection they planned to carry out with the installation of a cable car. Former Republican Governor Leland Stanford moved there, as would railway entrepreneur Mark Hopkins, Jr. In a show of power, Crocker became an even higher mansion on the hill, nearly 23 metres high and over a thousand square meters wide. Right past the Yung. The neighborhood began to be known as Nob Hill, translated as “the hill of the rich” (nob, in Anglo-Saxon jargon, means “rich and distinguished person”). For the installation of all these ostentatious homes, Crocker and his associates had not found too much resistance from the former residents, but in the northeast corner of their own block, the businessman, who had acquired 12 plots of 13, came up with an unexpected enemy. Yung's house was ridiculous in comparison to those gigantic buildings rising around him. Their views were no longer so good because of them, to begin with. And Crocker, as a tycoon and manager of an exclusive neighborhood, also didn't like a working-class family ruining the incomparable framework that lay before him. He offered $3,000 (with inflation, the equivalent of more than $83,000 today; that is, more than €78,000) to Yung to leave, like his former neighbours. But it wasn't going to be that simple. And it's not that Yung was any anti-gentrification activist: he simply heard that Crocker had paid someone else the devastating $25,000 figure for the land of his house, so he aspired to a better offer. The negotiation was gradually gaining ground. Crocker went up to $6,000 first and 9,000 later, but the lucrative precedent, which was perhaps a rumor or perhaps true, had convinced the funeral home man that he should stand firm. According to newspapers of the time, Yung announced that he would settle – in the broad sense of the term – for 12,000 dollars. The figure was affordable for Charles Crocker, but not for his pride. Disturbed by a humble immigrant beating his pulse, the tycoon raised his tone: he instructed his workers to drive the debris resulting from the dynamite they were detonating to level the hill to the Yung house. That did not work, and Crocker increased hostilities by investing $3,000 (the amount he did not want to add to his last offer) in installing a wooden fence of nearly 13 meters high to cover the family's home. The installation of a fence erected with the unique purpose of enervating a neighbor (which has its own concept, spite fence or spite wall, something like “wall of contempt”) is currently punishable by law, but not in 19th century California, to the misfortune of Nicholas Yung and his own, who should have gotten used to living in darkness, without the views or fresh air of that home of their dreams that had acquired time. The crazy montage became a real tourist attraction thanks to the cable car, just as the Numantine resistance of Yung, who did not have a hard time winning public opinion, acquired rank as a symbol of the struggle between the man on foot and the voracious capitalist machinery. The San Francisco Chronicle newspaper referred to the wall as a “crime” and a “monument to evil.” From the pages of that same diary, Yung picked up the glove and challenged his rich neighbor to build a higher wall: according to him, his plan was to place on top of his house a flag with skulls and bones next to a giant coffin, as an announcement for his funeral home and also as a reminder of the death that would frighten the neighborhood's millionaires. He does not know that Yung fulfilled his threat, but in 1880 he made his own the warning about the fleetingness of life and died. The story, however, was far from over: Roseta, his widow and accomplice in this quixotic struggle, did not want to sell either. Charles Crocker would die eight years later without seeing his wishes fulfilled. Mrs Yung would also reject offers from a Chinese laundry and an advertising company. Unfortunately, she would not live to see the wall removed despite her appeals to the City Council, as there was no specific legislation. Upon his death in 1902, The San Francisco Chronicle dedicated an editorial to Crocker’s heirs for “preserving the witness of spite” of the millionaire and maintaining his “legado of hatred,” rather than overthrowing him. The children of the marriage, however, quickly understood the Crocker family and sold the land for an undisclosed amount. The wall of contempt fell in 1905... as the whole new property would fall a year later, with the famous San Francisco earthquake, between 7.5 and 8 degrees on the Richter scale, which left at least 10,000 dead. After the fateful event, the space was donated to charity and on it currently stands the Episcopal Church Grace Cathedral. The temple is recognized, among other reasons, for having hosted one of the speeches of Martin Luther King, a religious concert of Duke Ellington or having served as a stage in films such as Bullitt (1968), The plot (1975), The Bicentennial Man (1999), My name is Harvey Milk (2008) or Venom: There will be slaughter (2022). Beginning in 1956, the State of California enacted a law that definitively prohibited the installation of walls of contempt; that is, without greater function than that of removing views of a neighbor to bother him, in harmony with most states of the country, which limit them to a maximum of 6 feet (1.83 meters). This has not been an obstacle, it has been redundant, for other citizens to explore creative ways to annoy others. Also in California, justice had to intervene to rule that planting tall trees at the edge of a property was considered another form of wall of contempt, after a resident of California responded to the reform that a neighbor had made in his home to see the mountain. In 2008, a Utah farmer placed three old cars upright as a fence between his livestock farm and the neighbors, who, according to him, had complained about flies and dust, but were not in favour of installing a fence (half-paying) because they liked to see his garden, horses and cattle. The farmer called his work Redneck Stonehenge, referring to the famous megalithic monument of the United Kingdom and the conservative Southerners (rednecks), although he stated that his intention was only to remind the new inhabitants of the area that that was the field and that the cars would not stay there permanently. History shows that the walls of contempt can also rise for oneself: such was the teaching of the Irishman Robert Rochfort, Count of Belvedere, who in the 18th century built the today known as the Wall of Jealouses in the city of Mullingar in order not to see the huge mansion that his brother George (suspected, for more inri, had he slept with his wife) had been built in front of his house. You can follow ICON on Facebook, Twitter, Instagram, or subscribe here to the Newsletter.","The numantine resistance of a humble inhabitant in a Californian neighborhood of new rich people curbed, in 1876, the real estate plans of tycoon Charles Crocker, who, after several attempts to demotivate his rival, decided to surround his house with a wooden fence",NEU,0.9665789604187012
