date,title_es,translation,summary,sentiment label,sentiment score
12-31-2022,"Lecciones de la guerra en Ucrania: de la flaqueza de Putin a los límites de Occidente
","Russian aggression shows an extraordinary portrait of the military capabilities of the forces involved as well as the geopolitical positioning of the countries of the world ""There are many lessons that spring from the war in Ukraine. Lessons we are learning. That Europeans learn. That President Xi and the Chinese armed forces learn,” said General Mark Milley, president of the U.S. Joint Chiefs of Staff, recently. Political, military and business leaders from all over the planet investigate the conflict in search of keys to understanding the modern world, the balance of strength, the future flow of events. What are these lessons?This is an abundant catalogue, relevant, full of nuances. At the military level, of course, because it is the first great confrontation in decades between one of the world's greatest war powers and an adversary with remarkable conventional potential. But not only in the military, but also in the geopolitical, because, as Pol Morillas, director of the CIDOB centre of international studies points out, “Russian invasion is an ordago that challenges the current world order,” and in that sense it concerns and portrays everyone. Next, an attempt to point out some of the great lessons of the war in Ukraine in 2022. The conflict is, at the outset, a reminder of the enormous difficulty of invading a country with an adversary who, although inferior in terms of means, is determined to defend his independence. “It is in a sense the same lesson as Vietnam,” says William Alberque, director of the Arms Strategy, Technology and Control department of the International Institute for Strategic Studies (IISS). Or Afghanistan, among others. But the case of Ukraine has a special value because it allows to project with precision the calculation on a possible Chinese attack on Taiwan, the most dangerous tension zone in the world, based on a very similar scheme: offensive of great power (Russia/China) against inferior adversary (Ukraine/Taiwan), but with military support of the highest power (USA) and strong sanctioning reaction (of the western bloc). “China is no doubt studying events with growing panic, understanding that a hypothetical attack on Taiwan would be much more difficult and costly than it assumed until recently,” says the expert, who previously was director of the NATO Arms Control Center. But the dynamics of war in Ukraine and the Russian setbacks say much more, starting with the pre-invasion phase. The development of events underlines, for example, the critical importance of adequate intelligence and analytical capacity. The Kremlin completely failed to weigh the resistance that Ukraine would oppose and the reaction of the West. This analytical short circuit led to a maximalist strategy of attack that proved completely wrong. “Western services, on the other hand, had a remarkable performance, greatly improving with respect to past crises,” says Cathryn Clüwer Ashbrook, Executive Vice President of the Bertelsmann Foundation. The U.S. saw the invasion coming, properly transmitted the information to the Allies, and this facilitated preparatory work. At the tactical operational level, the inability of Russian forces to react with agility to the problems encountered on the battlefield has emphasized the importance of command and control structures that delegate a margin of operational discretion to well-prepared intermediate officers. “In Western forces this is praxis,” says Alberque, but the invasion has shown a harmful level of rigidity in the Russian chain of command, as many experts have argued, including those of the British Royal Institute of Services. On the contrary, the Ukrainian forces have demonstrated an extraordinary capacity for adaptation and flexibility. In the first case, learning to use and integrate dozens of different types of weapons; in the second, reacting intelligently to tactical challenges. “I think this war will be studied a lot in 50 or 100 years, and I think Ukrainian officials will teach for decades in Western military academies, largely to explain the extraordinary adaptability and flexibility they have shown,” Alberque says. The merit of the enormous setbacks suffered by Russia lies to a large extent in those qualities and in the courage of the Ukrainian forces against an opponent with much less motivation. But their resilience to an enemy with greater means also points to persistent Western military superiority. The training and intelligence provided, as well as, of course, weapons, have undoubtedly played an important role. Even without delivering the most sophisticated systems, Western support has had a fundamental weight, which reminds us that two decades of supposed great modernization of Russian forces on paper have produced a very mediocre result. Here, China will also be recalculating the real potential of untested modernization investments. “The war has made us see many things: that Russian forces rely more on Western technology than we thought, that the level of internal corruption is higher than we thought, and that the share of well-equipped and trained troops was small compared to a large majority with lower standards,” Alberque says. “However, to conclude as some do that the Russian armed forces are pathetic would be a serious mistake. They have suffered serious setbacks, lost a lot of material, are not flexible in command and control like Europeans, but they rely on volume, and remain a rather formidable force. There is a risk of overestimating their problems,” continues the analyst. Clüwer Ashbrook agrees: “They have suffered a lot, but they are not sunk. They're still there. They also learn, adapt, moving their arsenals away from the new Ukrainian reach, unleashing a barbaric offensive against civilian structures. They also have resilience.” Just as Russian difficulties should not precipitate too radical conclusions, neither is it rational to conclude that all are lights for the West. The Ukrainian conflict shows how unprepared many of its arsenals and industry are to sustain prolonged friction warfare efforts, Alberque says. There is a lack of ammunition, sufficient spare parts for certain items. “Probably the high concentration of spending on a small number of sophisticated weapons programs is also a mistake,” says the IISS expert. The conflict has also demonstrated the need to recalibrate anti-aircraft defences. Both high-quality systems are needed to intercept ballistic missiles, as well as simpler, widely usable systems to defuse the potential for cheap drone swarms. As for the cyber domain, the conflict shows that a well-organized defense can deactivate a potentially annihilating tool. This section, according to Alberque, recalls the need for thorough preparation to adapt to the threats posed by adversaries. Ukraine's resilience lies in the fact that it has been in combat with Russia since 2014 and since then, albeit with limited means, has made extraordinary efforts to adapt to the risks. The expert believes that many European countries have not adequately prepared themselves to face serious military challenges. In geopolitical terms, perhaps the main considerations linked to the invasion are a lesson and a portrait. The lesson is the risks inherent in the excessive dependence of an adversary on a connected world as never before. The portrait is the picture of the state of strength and the positioning of countries and blocs in the face of the will to change the world order that, among other things, the Russian attack represents. In the first aspect, in addition to the total decoupling of the West and Russia, it is worth highlighting the movements of the former to reduce their dependence on China. This covers different areas of supply chains, including strategic raw materials, as demonstrated by the European Commission's plan to foster greater EU resilience in this section. “The big question is how far this decoupling will go. The level of interconnection is such that I think it is most likely a selective decoupling,” says Morillas. ""It is a very complex movement that will generate tensions within countries, within the EU and within the transatlantic community. China is aware of the enormous strategic asset that this dependence entails, and tries to cultivate it,” says Clüwer Ashbrook. As for the vigor and positioning of countries and blocs, the moment has been revealing. The West has responded “with a considerable degree of unity” to the invasion, according to Clüwer Ashbrook. The response in terms of sanctions against Russia and military, financial and humanitarian support to Ukraine has been swift and very significant. The expert highlights how the preconditions were far from ideal, not only because of the tear between the two sides of the Atlantic that occurred during the Trump stage, but also because of the frictions that surfaced even in Biden's, as evidenced by the withdrawal from Afghanistan or the Aukus pact (the military agreement signed between the United States, the United Kingdom and Australia). Both these disagreements and the alleged dynamics of decline of the West in the early months of the century, with the economic crisis of 2008, the triumph of populist forces, with the weak reaction to Russia's offensives in Georgia (2008), Ukraine (2014) and Syria (2015) were, along with other factors, among Putin's elements of calculation. All these elements are being reconsidered on a global scale, with the renewed vigour of NATO — which Macron declared a state of brain coma a few years ago. The West closed ranks, and has acted effectively. Moreover, within Europe, “the EU’s ability to converge ranks and find quick, functional solutions has been quite impressive,” says Ashbrook, drawing attention to many problematic elements, such as Hungary’s vetoes. Morillas agrees in appreciating the resilience of the Atlantic link and of the European reaction and also invites to maintain an important caution in its long-term projection. The year of the invasion has made it clear that there is nothing comparable in the world to the degree of union displayed by NATO countries, the EU and its Asia/Pacific partners, such as Japan, South Korea or Australia. Russia, on the other hand, has not found support open to its brutal challenge to the world order. The invasion is an imperialist movement, of reaffirmation of power in its surroundings, but also a brutal manifestation of rejection of the world order embodied around Western values after World War II. Moscow no doubt longs to be the pioneer of a broad subversion movement. But, for the moment, this one is not coming true. China, which signed a declaration with Russia in February that precisely presented a vision of an alternative global order and announced a relationship with Russia without limits, has shown that the limits exist: it does not want a disruption of the global economic order or irritate the West to the point of profoundly disrupting the commercial interbrication from which it draws so much profit. Even so, in the geopolitical as in the military section, the central assertions are full of nuances. “In short, the reaction of the West has been remarkable; but measures have not yet been taken to ensure that this revival will last. There remain problems and strategic differences among Western partners,” says Morillas. Clüwer Ashbrook warns, in particular, that within the EU it should not be taken for granted that cohesion remains and remains effective. The expert points out the clear cracks in the Franco-German axis, and a shock to the usual Western/East balance of power within the EU, with the credibility of the first touch, while the countries of the second claim the validity of their historical vision of alert to Russia, as well as to bear an important part of the burden of hosting refugees and helping Ukraine. On the other hand, if the core of the liberal democracies that unites some 40 countries in Europe, North America and Asia/Pacific has closed well ranks, the West has not been able to gain strong support in the global South. Dozens of these countries voted against the U.N. invasion — totalling 141, compared to the 4 who voted with Russia, 35 abstentions and 12 who did not exercise the right to vote — but have not joined the sanctions. The 35 who abstained in that vote represent half of the world ' s population. The non-aligned strongly defend their position, and cases such as that of Saudi Arabia — a traditional ally of the United States that has maintained its own course in oil production policy — or of India embody it well. “New Delhi does not like the invasion, let alone nuclear threats, but does not bow to the wishes of the West. It makes it clear that it has its interests, a huge market to supply energy, and as long as Russian crude oil is good for it and the West offers nothing better, it is still on its way,” says Clüwer Ashbrook. “In this more complex, more multipolar world, the middle powers try to play a weighty role,” adds Morillas. In this context, even with heavy blows such as the asset freeze, sanctions against Russia have a limited scope. The Russian economy has contracted, undoubtedly facing serious production problems due to a lack of components, but there has been no collapse, the ruble remains stable. These are some considerations linked to the war in Ukraine. There are, of course, many more, from the fundamental role of leadership and communication to reflection on the cost of not vigorously objecting to certain scores in time, and then having to endure a much greater onslaught. It subdues to all the eternal lesson, shared by all conflicts, of the enormous suffering of civilians. Among many other things, the unjustified and illegal Russian aggression will be remembered by the abjection of submerging the non-combatant population in the dark and cold. Follow all international information on Facebook and Twitter, or on our weekly newsletter.","The conflict in Ukraine is a reminder of the enormous difficulty of invading a country with an adversary who, although inferior in terms of means, is determined to defend his independence.",NEG,0.6065332889556885
12-31-2022,"Jersón celebró con júbilo el fin de la ocupación rusa; ahora el Kremlin se venga arrasando la ciudad
","After his retreat across the Dnieper River, Putin's army unceasingly attacks the town that was his greatest victory. Joy has given way to hopelessness in some citizens Stanislav sharpens the ear and hastily closes the trunk of his broken red Lada. The car is going to overflow with water claws, milk cans and tea packs that load for the few remaining neighbors in the area. There's no time for delivery. A soldier runs from the bank of the river and takes cover, crouching against the red brick wall of a house. “One, two, three, four... 15,” the uniform recites, waiting. An explosion rumbles in the neighborhood of Naftohavan, in Jerson. And then another one. And another. On the other side of the Dnieper, less than a kilometer away, there is a position of the Kremlin troops. The waters of the river have become a grey area, on the front line of the battle line over which the Russian missiles that ravage Naftohavan and all of Jerson fly. A city that celebrated in November with joy the withdrawal of Vladimir Putin's forces after eight months of occupation, and in which the joy of liberation has faded like a sugar in the muddy waters of the Dnieper, under missiles, mortars, drone bombs. Russia has lost Jerson and now it blows it up, as if it wanted to tear it to the ground. Naftohavan, of low houses, some extremely flirtatious, and other constructions of precarious wood, was once planted with rural houses and businesses of water activities. Now, its proximity to the river has made it one of the most dangerous points of Jerson, in the sights of Russian projectiles but also of snipers. “It’s not just that they want to come back, they’re getting revenge. And if we don’t get killed by missiles, they want to kill us in fear,” says Stanislav, a man who is white, with brown skin and yellow nails from the nicotine of cigarettes he smokes non-stop. “But if they didn’t scare us when they were here, neither now,” he says. Since Vladimir Putin's troops left Jerusalem—stealing everything they could, including the treasures and relics of the art museum—in early November, the city's daily life, which before the invasion had some 300,000 inhabitants, is summed up in constant attacks, explains Commander Kostantin. Muscular and slender, the former member of the special forces reincorporated into the Ukrainian army in the early months of the invasion, moves safely through the ruined airport of the city in which he was born, a place planted with gutted planes and remnants of what was one of the most promising airfields in southern Ukraine. The farthest tracks still hide mines. Like a round, unexploded device that Commander Kostia discovers in the grass and points out with his modern American rifle, his personal weapon. “Nothing will be safe at all until we get those orcs [as many Ukrainians call Russian soldiers] out of the burrows,” says the military. The Ukrainian army has reinforced its positions in Jerson and is trying to push Russian troops from the adjacent riverbank, but for the moment all attempts to take control of that point of the Dnieper and to send incursions beyond the grey zone have been fruitless. Jerson, considered a strategic city and the gate of the Crimean peninsula — illegally annexed by Russia in 2014 — quickly fell into Russian hands in early March, during the early days of the invasion. The Kremlin had worked on it, noting a source of Ukrainian intelligence. He had collaborators inside: in the regional and local administration, in the police, some businessmen in the area. In addition, his defense was not designed in an exemplary manner either. But Putin took much more than he could cover. And a successful Ukrainian counteroffensive, fueled by well-trained troops, information and weapons that Western partners have provided to Kiev, forced Kremlin forces to withdraw. The loss of Jersón, who was sending grain from his port to half the world before the war, has been a very hard setback for Putin. It was the only regional capital that had conquered since the beginning of the offensive in February. Russian forces have now moved to defensive positions across the Dnieper River. From there, they subject Jerson to a constant rain of projectiles. On December 25, when Ukraine’s allies and many of the country’s Catholics and Orthodox were preparing to eat with their families to celebrate Christmas, Russia unleashed on Jerson what Irina Mijailova describes as “armageddon.” Since that day, the octogenarian has not moved from her home. He spends the day at the doors of his building, sitting on a stand on some woods, clinging to his wooden staff and chatting with his neighbor Tatiana. Three attacks on the city centre killed 11 people and injured 70 that day. More than 40 mortars fell on the streets of the city. The Russian projectiles killed a woman who sold SIM cards for mobile phones in the street, a social worker, a butcher, a young man who had gone to Jerson to evacuate his sick mother. He followed the lives of people who had approached the city center in search of cash or to buy in the central market. Not too far away, the main square of Jersón, presided over by the administration building, which hosted jubilant celebrations for the liberation of the city and in which the president of Ukraine, Volodimir Zelenski, raised the flag of the country on an emotional visit, is almost deserted. Just a couple of people walk the sidewalks in a pacifying December. It's starting to get dark and a yellow trail runs through the sky. In another life it could be a shooting star and yet it is an incendiary projectile. Irina Mijailova was a teacher for years in a city she loved deeply. It took him a long time to get his little apartment, he says. “We had a good life. Now I know,” he laments. In his house, he says, it's colder than on the street. Miraculously, there is water and, from time to time, light; but there is no heating. Russia is vigorously applying itself to Ukraine's energy system to try to break the resistance of the citizenry. And in Jerson, the problems of supply are compounded by the anxiety of living under continuous attack, especially during the night. Since December 25, hundreds of people have left the city and the authorities are asking those left to leave. In the entire block of Irina Mijailova and Tatiana, which for years led one of the city's trolleybus routes, there are only four people and a colony of kittens, running through the courtyard full of gaps and debris. Some crystals are broken, but the apartment building of Irina Mijailova has run better luck than the one on the corner, completely smashed. It smells like light. Someone's lit a bonfire. Very close to the ruins, the generator buzzes that nourishes a small café-bar. Outside, two men talk, standing, while drinking beer in plastic glasses. “It’s early and we’re already drunk, what we’re going to do,” one throws, dressed in a red camouflage suit with a waterproof look. The regulations prohibit the sale of alcohol in the city, both for civilians and for the military. But the little bar still has a pretty drink-worthy card, and the uniforms seem to turn a blind eye. The man in a camouflage suit pulls out his mobile phone and with shaky fingers searches his gallery: “I have nothing left, you know?” And it shows a video of a totally collapsed low house. Beams, debris and twisted wood. It's his house. A Russian missile shot her down a week ago. There hasn't been a day in weeks when an attack hasn't killed anyone in Jerson. Or reach someone's house. On Wednesday, a Russian projectile impacted the maternity wing of a hospital. Thursday, at a medical center specializing in cardiology. Maria, or “Grandmother Mary”, as she likes to present herself, has arranged herself, as every morning, in a house without light or gas. She has painted her lips pink almost matching her violet beret and has gone down to the street, where she watches a group of men trying to fix an electric pole in the Antonovka neighborhood, too close to the river. The soil and grass are full of debris and Grandma Maria says that a few days ago debris from a rocket fell on the area. He claims that he celebrated the withdrawal of Russian troops and the arrival of the Ukrainian army as well, after living eight months practically locked up at home, with “fear even of breathing.” But she's tired. And angry. “I may be told that I am ungrateful, but this is a hardship. Not only the attacks, we have nothing, there are hardly any shops open here, there are no banks and it is almost impossible to collect the pension,” he says. The men who swirl to lift the pole point to disgust that humanitarian aid reaches the neighborhood with droplets. And the one that does it is a private organization, an evangelical church. They're complaining about the administration. They feel neglected. “It’s not that we lived better with the Russians, those fascists, that’s true, but I thought things would be another way,” laments Grandma Maria. City inside, in one of the few supermarkets open these days, there is no pin. Boxes with new products accumulate in the corridors, still unplaced. The assortment is good and showy. And the prices, similar to those of other places in Ukraine. While pulling from a plastic basket with a solitary bottle of sunflower oil, Oleksandr and his wife Sveta explain that during the Russian occupation prices were in rubles and everything was much more expensive. Sveta, blond hair picked up on a ponytail, clung to her husband's arm and whispered that her 20-year-old son had been detained by Moscow troops at the beginning of the invasion. He's been missing for 10 days. He never left home again: “I’ve already experienced a nightmare, what else can happen to us? We're being bombed? Kill us? That they don't come back, I'll settle for it. I hope they will sweep you off the face of this earth, even if you are no longer here to see it.” Follow all international information on Facebook and Twitter, or on our weekly newsletter.","Russian President Vladimir Putin celebrated the withdrawal of his forces from the Ukrainian city of Jerson in November, but the joy of liberation has faded like a sugar in the muddy waters of the Dnieper, under missiles, mortars and drone bombs.",NEU,0.823756992816925
