date,title_es,translation,summary,sentiment label,sentiment score
12-31-2022,"El mundo mira de nuevo a China con temor tres años después del inicio de la pandemia
","The abrupt change in strategy by the Chinese authorities and their opacity have raised concerns about mutations that escape vaccines. For now, the cases coming from the Asian country are already known variants in Europe Three years of pandemic and more than 15 million deaths have left the world with very painful lessons. One of the first was that the only way to fight the coronavirus without vaccines was through relentless confinement. Governments later learned that any return to normalcy would go through careful monitoring of the incidence as the first doses began to immunize the population. A year ago, the omicron variant, the most contagious virus in history, arrived, becoming something like a dose of natural memory for hundreds of millions of people. The number of contagions was so large that it was impossible to count, but this was already losing importance in the face of the great reduction of serious cases thanks to the protection achieved. And now, when they thought they had the whole agenda studied, Western countries find themselves looking again at China, trying to interpret the few facts available and wondering if they are facing one of the last pandemic hives or in a high-risk situation that can send them back to the check-out box. “There is concern about the evolution of contagions in China, as well as about the difficulty of making a proper assessment of the situation given the limited information currently available to us.” With these words, the Minister of Health, Carolina Darias, summarized the uncertainty that exists this Friday. The Spanish government is, after Italy, the second European to impose border controls — negative diagnostic test or vaccine certificate — on travellers from China, which has also been done by the United States and several Asian countries. The measure, however, is born with controversy. While several communities have asked Health to tighten it, rejecting Chinese vaccine certificates for the less effective serums used in the country and testing all travellers, most European countries reject it for now. “They are not needed yet,” said German Health Minister Karl Lauerbach. The reason given is that the European Centre for Disease Control and Prevention (ECDC) has also pointed out this Friday: the variants circulating in China are the same already in Europe and therefore “do not pose a threat” to the population of the continent. The first flight to be controlled by the government is scheduled to land in Madrid at six o'clock this Saturday afternoon. According to Sanidad, “passes from the Asian country will be able to pass through a documentary, visual and temperature control, in addition to carrying out a diagnostic test of active infection by SARS-CoV-2, at the point of entry to Spain”. “From the epidemiological point of view, when the circulation of the virus is already high as it is now, it doesn’t make much sense to reduce the number of cases entering a country if the variants are going to be the same. The key is to quickly detect if new forms of the virus arise, because then you can change everything,” says Miguel Hernán, professor of epidemiology at Harvard University. The need to strengthen surveillance through genetic sequencing, testing for new variants of the virus, has been the most repeated message by the European Commission in the last two days. This, however, should not necessarily involve testing newcomers from China, but is based on the systematic screening of a sample of positive cases detected in a particular area. Juan Carlos Galán, head of Virology at the Hospital Ramón y Cajal in Madrid, says that according to the latest tests, “nothing makes us think about new mutations or [in which] the risk of vaccine escape has increased.” The fear that new variants will emerge has been triggered by some figures that give an idea of the gigantic wave of new contagions that China suffers after the end of the restrictions. As Bloomberg advanced, citing data handled by Chinese health authorities, nearly 250 million people would have been infected in the country in the first three weeks of December, 37 million in a single day, on the 20th. “They are huge numbers and it is true that whenever there are more contagions, the number of mutations increases and, therefore, the risk of new variants arising. But it is also not so different from what has been happening in the United States and other countries where it has been allowed to circulate without many restrictions to the virus,” says Quique Bassat, ICREA researcher at the ISGlobal Institute (Barcelona). Pedro Gullón, professor of public health at the University of Alcalá, adds: “It is never positive that there are very high transmissions somewhere in the world, because of the impact it will have on the local population and the risk of new variants, but in a global situation of community circulation of the virus I am not very clear about the real risk that this entails.” Experts do agree that the alert situation should serve to boost the administration of booster doses among the Spanish population, which has been lagging behind in recent weeks with regard to the coverage initially achieved. According to the data of the Ministry of Health published on Friday, 73% of the population over 80 years of age has already received the fourth puncture, a percentage that is reduced to 62% among those aged 70 to 79 and to 41% among the sexogenarians. This second dose is updated to protect against the variant omicron in addition to the original form of the virus. In any case, even with the coverage already achieved, experts believe that the epidemiological situation should not change too much in Spain in the coming weeks if new variants do not emerge. In fact, according to Friday Darias, the situation of new cases among the supervised population (over 60 years) is of “stability and even a slight decrease”. “What has precipitated what is happening has been the abrupt end of the restrictions applied by China, but it was something that was going to happen in any case faster or slower. Omicron is so contagious that once it has entered a country you cannot stop it without virtually total confinement. What China has not really managed to do well has been to achieve adequate vaccination coverage among its population. This is what now triggers the risk of serious cases and deaths. Spain and the developed countries are not in this situation,” says Miguel Hernán. Only 69.8% of those over 60 years of age in China have received the booster dose of the vaccine, which is reduced to 42.4% in those over 80 years of age. In addition, the two serums used in the country, Sinovac and Sinopharm, have proved less effective than those used in Western countries or Russia. The need to resort to constant local confinements and the obligation to subject the population to virtually daily PCR tests due to the constant outbreaks caused by the high contagion of the Omicron variant is one of the reasons why the population was fed up with the incidents that led the Chinese authorities a month ago to put the restrictions suddenly behind them. It is an example, like the low coverage achieved, of the complex relationship between science and politics that has ended up weakening the response to the pandemic in countries like China, according to Fernando García Benavides, professor of Public Health at Universitat Pompeu Fabra (Barcelona). “When a country allows free public debate, this often leads to the modification and improvement of measures taken that lead to unwanted results. In democracy, this is a gradual process that institutions manage to articulate properly. China, on the other hand, has not been able to do so. This has prevented him from adopting changes on the fly and has ended up applying them when the situation was already unsustainable, with flocks that in turn have caused other problems,” concludes this researcher.",Spain is the latest European country to impose border controls on travellers from China because of the spread of the SARS-Co virus.,NEU,0.517605185508728
12-31-2022,"El Congreso estadounidense publica las declaraciones de impuestos de Trump que el expresidente rechazó divulgar
","The tycoon paid $1.1 million in federal taxes in his first three years as president, and no tax in 2020 In discount time, days before the House of Representatives passes into the hands of Republicans, a Democratic-controlled commission has released the tax returns for six years of former President Donald Trump. The publication of the records, edited, puts an end to a long legal battle waged by the Republican to prevent them from seeing the light, but not to the controversy surrounding the Internal Revenue Service (IRS), unable to accurately scrutinize the tycoon's turnover while in office. The revelation adds another bucket to Trump's record after announcing his intention to run for election in 2024. According to data released this Friday, Trump paid $1.1 million (just over a million euros) in federal income taxes in his first three years as president, and nothing in 2020, when his income began to decline. Once he arrived at the White House, the tycoon gave his older children the reins of the family emporium, the Trump Organization, which, according to records, had a adjusted gross income of $15.8 million in his first three years as president. In the two years prior to his arrival in the White House, the Republican recorded large business losses, as shown by the records of fiscal years between 2015 and 2020. The ex-mandator has attacked the Democrats and the Supreme Court with a message on their social network, Truth Social. “The Democrats should never have done it. The Supreme Court should never have approved it, and it's going to lead to horrible things for a lot of people. The great division of the United States is going to be much worse,” Trump said. “Tax returns show once again how proudly successful I have been and how I have been able to use amortization and other tax deductions as an incentive to create thousands of jobs and magnificent businesses,” he added. Until the decision of the Supreme Court, which last month postulated the delivery of Trump's declarations from 2015 to 2020, the work of the House Media and Arbitrian Committee, chaired by Democrat Richard Neal, had been a continuous setback since 2019. The Republican went through all possible instances judicially to prevent them from seeing the light, with arguments as peregrine as that the business dimension of his real estate emporium prevented him from evaluating and accounting for them. Similar argument was used to explain the IRS' myopia, which could not fully audit him during his term of office, despite the fact that the committee passed a law that would force the Treasury to complete the face-to-face audits within 90 days of taking office. “A president is not an ordinary taxpayer. It has power and influence unlike any other American citizen. That great power implies even greater responsibility,” declared Richard Neal in a statement. After coming out of two impeachments to which he was subjected by the 76-year-old House of Representatives, Donald Trump faces a complicated legal offensive that can tarnish his political future or, conversely, give wings to his most extremist supporters. The congressional committee that investigated the assault on the Capitol has asked to prosecute Trump for four crimes, including obstruction of justice and insurrection. The FBI seized confidential documents that the Republican had taken from the White House, and two ongoing investigations in New York City, one of a civil and one of a criminal nature, analyse his business for alleged tax fraud. The House Media and Arbitrians committee requested the statements in 2019, arguing that Congress needed them to evaluate the IRS' audit of presidents' tax returns, a purpose Republicans considered to be politically motivated. Trump, who took office in January 2017, was the first presidential candidate since the 1970s not to make his taxes public. He sued the committee to try to keep them private, but the high court, with a conservative majority, ruled against them. In 2016, when he was still a candidate for the presidency, the tycoon pointed out the scale and complexity of his finances as a reason to challenge the tradition, followed by all candidates to occupy the White House, of religiously publishing his tax returns. “They’re not like a normal tax return,” he said in a TV interview. Over the next seven years, the Republican has also resisted making them public, first, he said, by an “invasive” IRS audit motivated precisely by his refusal to publish them; then, since 2019, in response to the House Committee’s initiative. Records show that Trump's revenue and fiscal obligations fluctuated dramatically from 2015 to 2020, during his presidential campaign and subsequent term. They show that Trump and his wife, Melania Trump, benefited from large deductions, claimed losses, and paid few or no income tax in part of that period. In 2016, the year he won the election, and 2017, the first in the White House, the Republican paid $750 in federal taxes, according to a 20-year investigation of fiscal information published by The New York Times in September 2020, two months before the election. The exclusive showed that she had not paid income taxes in 10 of the previous 15 years, largely because from 2011 to 2018 she declared losing more money than she had. Follow all international information on Facebook and Twitter, or on our weekly newsletter.","The publication of the records, edited, puts an end to a long legal battle waged by the Republican to prevent them from seeing the light.",NEU,0.9565959572792053
12-31-2022,"Lula regresa al poder para reescribir su legado
","The leftist will take possession of a third term in Brazil this Sunday, New Year, after defeating Bolsonaro When on New Year 2019 Jair Messias Bolsonaro arrived in a Rolls Royce convertible at the ceremony, in Brasilia, to be named president, the first far-right in the history of Brazil, the man who will succeed him this Sunday, Luiz Inácio Lula da Silva, was imprisoned for corruption in a police station, not in a prison, in his capacity as former head of state. Lula read books like never before in life, exchanged a daily letter with his girlfriend (today wife), who sent him marmites with homemade food, exercised, and designed with lawyers and his closest collaborators a political return that then sounded like delirium: because of his age — he is 77 years old — and because of the ristra of judicial cases that he had pending. He never stopped proclaiming his confidence in Brazilian institutions and that he was the victim of persecution. When he receives the presidential girdle in front of Planalto's modernist and glazed palace this Sunday, a surprising political resurrection will culminate. He returns to rewrite his legacy, with the mission of rebuilding social policies and democracy after Bolsonaro, with the dream of being remembered inside and outside his country as the Lula of glorious times, not that of judicial odyssey. The ceremony of 1 January will also be the anniversary of the extraordinary moment that Lula starred in 20 years ago, when he became the first worker—and first leftist—to come to power in an unequal and classist country where, in some privileged neighborhoods, employees are still relegated to use elevators different from those of their employers. During the 2003 New Year Lula announced that his great mission as president would be for every Brazilian to have breakfast, eat and dine every day. For a time it was, but with the pandemic the hunger returned. Today there are more than 33 million Brazilians who do not know if they will dine tonight or have breakfast tomorrow. Combating hunger and poverty will be the priorities of the new president, together with the economic revival and the strengthening of democracy. “We need to create jobs, pay wages, distribute income and make people suffer less than they have been suffering,” the president-elect announced this Thursday in Brasilia, presenting the last names of his Cabinet. He ardently defends that the poor also have the right to enjoy the pleasures of life and to be happy. For this campaign he reformulated the slogan “hope will overcome fear” of 2002, as “love will overcome hatred”. Take over from former military officer Bolsonaro, a president who has not recognized Lula's victory, the hardest in history (almost two million votes, 1.8 points). He will assume power in a very polarized environment in which even the ghost of terrorism has appeared with a failed attack by a bagganarist. Bolsonaro himself condemned this action on Thursday. In addition to bombs, what was never seen in this country, Brazil was shaken two months ago by radical groups who camped in barracks throughout the country convinced that they had been robbed of the elections and calling on the military to put order, as in 1964. This order translates into asking Lula to be prevented from returning to the presidency so that, they say, “Brazil is not a communist country, a Venezuela.” In the 2003 New Year, Lula, as president, was a great unknown, a hopeful promise. After being defeated three times in the presidential elections, he reached the top of power with a loose victory. All of Brazil, except one state (Alagoas), dyed the red of the Workers' Party (PT). He was a person of the dream of the dispossessed masses and the fears of the markets, which he tried to appease. Now the country is divided into two halves. The north is Lula red, the south is purse blue. And the outgoing president's allies dominate Congress, although in both Houses everything is negotiable. It varies the price. In these two decades, Brazilian society has turned to the right, evangelicals gain space in society, politics, the music industry and the Supreme Court. And the winds of the economy, which blew in favor of Lula in his first two terms, are now blowing against him. The negationist and inhuman management of the pandemic sank Bolsonaro, who was elected to save Brazil from the corruption and evils of the PT. That, coupled with their strategy of attacks on democracy and institutions, turned Lula, who four years ago was a political corpse and one of the most hated guys in Brazil, into the desired solution to close a dark stage. Hatred of the Workers' Party evaporated, red PT stopped being banned on the streets. And when it became clear that the election would be a hand in hand between Lula and Bolsonaro with clear advantage for the former, economic power laid hands on pragmatism and recalled how well things went with him in the Presidency. With the skills of negotiator and strategist that even his enemies recognize him, Lula managed to get opponents of the entire ideological spectrum to join his leadership in cutting off the ultra-right and to dry up the authoritarian drift. As he said in the victory speech, “this is not a victory for Lula or the PT.” The challenge is huge. And expectations are on par. The Brazilian economy has not grown for a decade, the budget limits are narrow, false news and misinformation have seriously damaged the credibility of the institutions and satisfy the disparate partners that have put him up to power will require gifts of fine alchemist. Although the transition has taken a long time despite the noise of the Bolsonaro's own Bolsonaro's supporters calling for a coup d'état, Lula has suffered to form the Cabinet and distribute portfolios, power and budget among his allies. And that had 37 ministries to offer. But the really strategic ministries have left them in the hands of veterans of their party. And in economics he has gotten away with it despite the suspicions of the elites. He has entrusted economic policy to faithful Fernando Haddad, the man who agreed to replace him as a candidate for the PT four years ago when he was in prison. He has suffered to square the puzzle of the ministries. He announced the last names three days after the opening term. He'll rule with nine games. The Lula who will premiere 2023 inaugurating his third presidential term, obviously, is also different from that of 2003. She has government experience, she has gone through having appointed a successor, Dilma Roussef, who was dismissed on August 31, 2016 in the midst of a great wave of popular discontent. And he himself knows what it's like to fall into disgrace and spend 580 days in jail for corruption that in 2018 drove him away from the presidential race. The court cases against him were undone like a sugarcane because the judge who imprisoned him, now Senator Sérgio Moro—that's the plot in Brazilian soap operas—was not impartial. Lula led the wave of the Latin American left at the beginning of the 21st century, bringing the longings of the poor, and the aspirations of Brazil and the Global South, to the conclaves of the most powerful. She's over cancer. His story captivated his compatriots. And the world. He left the presidency with a higher popularity of 87%. As the Brazilian Constitution prohibits a third consecutive term, he embarked on an international career as a retired politician who had to leave when the judicial problems piled up. He's widowed. The New Year's Day will be well covered by the international community with almost twenty heads of state, including the king of Spain, Felipe VI, who already attended his other two inaugurations, the presidents of Argentina, Colombia, Chile or Portugal. The Spanish delegation also includes Vice-President Yolanda Díaz, and Foreign Minister José Manuel Albares. It is unknown who will hand over the presidential girdle, but Bolsonaro is ruled out. The ultra-rightist will live the end of his term thousands of miles from Brasilia, Florida. This Friday he flew to Trump lands after giving his last speech as head of state. Your successor just wants you to keep it quiet. “Let the one who lost the election be quiet. Whoever won has the right to hold a great popular party,” he said on Thursday. Shortly before he had reminded his future ministers to prepare themselves because he likes to work a lot and do many things at the same time and they are all younger than him. Subscribe here to the EL PAÍS América newsletter and receive all the current information keys of the region.","Brazil's President-elect Jair Bolsonaro arrived in a Rolls Royce convertible at the ceremony, in Brasilia, to be named president, the first far-right in the history of Brazil, the man who will succeed him this Sunday, Luiz Incio Lula da Silva, was imprisoned for corruption in a police station, not in a prison, in his capacity as former head of",NEU,0.9477133750915527
