date,title_es,translation,summary,sentiment label,sentiment score
12-31-2022,"Elon Musk o cómo dilapidar 124.000 millones en un año
","Frenchman Bernard Arnault, owner of LVMH, snatches from the South African tycoon the richest man scepter in the world. The 20 most wealthy see their heritage set back by nearly 34 billion in 2022 After a sweet 2021 for Elon Musk, when he crowned himself as the richest man in the world, a 2022 aciago. The U.S. businessman, in the eye of the hurricane since he became head of the Twitter social network in October, has seen his still vast fortune evaporated by 132 billion dollars (124 billion euros). Most of that fall, which has relegated him to second place in the global ranking of millionaires, is linked to Tesla's stock market bust: in 12 months, the electric car manufacturer who founded and runs, has lost two thirds of its value. A trend fuelled by the sales of shares executed by Musk himself. Tesla’s torment — which, however, had exponentially multiplied its market value in recent years — is by no means an isolated case among technological companies, companies that in record time have gone from living days of wine and roses — especially during the pandemic — to being forced to apply staffing cuts and costs to temper the concerns of their shareholders. The Meta (Facebook), Alphabet (Google), Amazon or Microsoft stock market hit has caused a real earthquake in the world ranking of billionaires, with their founders losing positions to forced marches. Mark Zuckerberg (Meta) has moved from sixth to not even one of the 20 greatest fortunes on the planet; Larry Page and Sergey Brin (Alphabet) are down from fifth and seventh in 2021 to tenth and eleventh in 2022; and Jeff Bezos (Amazon) is displaced from second to sixth. Only Bill Gates (Microsoft) maintains his position in the ranking, the fourth, although with a strong loss in the total value of his fortune, which goes from 138.000 to just over 109 billion dollars, according to Bloomberg's data. Musk's is, however, a separate case. Not only because he is the one who is most affected by his heritage, but because of his erratic behavior in recent months, especially after the purchase of Twitter. Knowing the fears, the controversial and iconoclastic businessman of South African origin sent this week an e-mail to Tesla’s employees — in many cases, also affected by the stock market shock, because part of their salary is paid in shares — asking them to calm down: “Don’t worry too much about the insanity of the stock market. As we demonstrate continuous excellent performance, the market will recognize it. In the long term, I firmly believe that Tesla will be the most valuable company on Earth,” he predicted. In a year of maximum volatility, both in the macroeconomic and the parquet sectors, which have suffered both from the uncertainty of the Russian invasion of Ukraine and from the aggressiveness with which central banks have responded to the inflationary escalation, the aggregate wealth of the world’s 20 greatest fortunes fell by $360 billion (336 billion euros). But the coup has not been much less symmetrical: the traditional sectors have weathered the storm much better. The best proof of this is the Frenchman Bernard Arnault, the top shareholder of the French luxury conglomerate LVMH (Dom Pérignon, Hennessy, Christian Dior, Bvlgari...), who a couple of weeks ago overcame Musk and became the richest man on the planet. It has been decades since a European closed the year leading the classification of billionaires, the historic private quota of Americans. Everything, despite seeing his fortune reduced by more than 13 billion. The other example of how the classic, defensive sectors have resisted much better than technology the impact of uncertainty and the escalation of interest rates, is the Indian Gautam Adani, already settled as the third most wealthy man in the globe. Head of an emporium that bears his name and encompasses endless businesses — from mining to sport — he has taken advantage of the juicy opportunity offered by the energy crisis to strengthen his own solid financial position. The bursting of coal prices has been a powerful tail wind, as have the bottlenecks in international trade: while global supply chains suffered the unspeakable, the division of their holding dedicated to maritime transport was made of gold. Adani is not just the first Asian to settle on the podium of billionaires. He is also the second national of an emerging country to do so, after the Mexican Carlos Slim, who now occupies twelfth place. His recent jump — a year ago it was fourteenth and until shortly before he didn't even make it into the top 20 — has been exponential: after doubling his fortune in 2021, this 2022 is scored a net gain of 44.6 billion dollars, an advance within reach of very few. And it contains a reading beyond the individual, of a geoeconomic order: India, a giant that is about to overcome China as the most populated country on the face of the Earth, already has two names in the bouquet of the eight richest in the world. The second in discord is Mukesh Ambani, the top shareholder of Reliance Industries, another colossus with interests in logistics, energy, telecommunications or infrastructure, among others. Despite Western domination — 17 of the richest 20 are Americans or Europeans — India's strength and, therefore, Asia can be interpreted almost as an advance in the coming world: the centre of gravity of trade and economy has already shifted from the Atlantic to the Pacific; and heritages, sooner or later, will follow its wake. From the global to the domestic. The founder of Inditex (Zara, Massimo Dutti, Bershka...), Amancio Ortega, remained in 2022 as the richest Spanish, with an estimated fortune of 55.2 billion dollars. They are, however, 12.3 billion less than at the end of 2021, a decline that dissipates them from the top 20, largely due to the loss of value accumulated by the textile firm, which is left almost 13% in a marked exercise from beginning to end by the war in Ukraine. Russia was, until March, the second most important market of the Galician company by number of shops. A first-order blow that has billed Ortega.","Elon Musk, the billionaire founder of Tesla, loses his position as the richest man in the world.",NEU,0.5400217771530151
12-31-2022,"Francisco Goldman: “Hay una nueva manera de leer con el afán de una policía moral”
","With ‘Monkey Boy’, the American writer endorses his mastery of the autobiographical novel and exploits memory as a literary space: a place of fact and fiction as well. He was beaten at home, humiliated at school and, as a son of a Jew and a Catholic Latina, an unidentified ethnic object in the Boston suburbs of that time. Through an ‘alter ego’, he courageously goes back to his life with a sense of humor that is lacking in the era of political correctness.There are not many people with the saving gift of laughing with laughter. Francisco Goldman (Boston, 68) is fortunate to be one of them. Without him he might not have been able to endure so much horror: his father's contempt and beatings; coverage of the Central American wars; the death of his first wife, writer Aura Estrada, by a wave that beat her against the sand and severed her spinal cord. Her love story with her and the final tragedy told them in a memorable work, Say her name (Sixth Floor, 2011). The subsequent duel overturned him in El circuito interior (Turner, 2014), a chronicle of his catharsis in his adopted homeland, Mexico City. In Monkey Boy (Storage; translation by Daniel Saldaña Paris) explores his childhood traumas and completes with the two previous books a trilogy that is a high level of the autobiographical novel. Recognized in 2022 with the American Book Award and Pulitzer finalist, it is a mosaic of memories that the author puts in the mouth of an alter ego named Frankie Goldberg, a name written on his own with which he mocks our pruritus of knowing what part of a book—and of oneself—is truth or lie. Frankie, like Francisco, today a blessed father of family who attends us on a visit to Madrid, is a child of the suburbs of Boston who in the school they nicknamed “chimpanzee boy”, son of Guatemalan mother, Catholic, sweet and fun, and father of Ukrainian origin, secular Jew, dental prosthetic, Democratic voter, lover of horticulture and fierce enemy of his own family. His name is Bert Goldberg, like that of Francis, who, likewise, made false teeth. Was Bert Goldman also a bad person?Well, I don't know if I'd say he was a bad person. Mostly I see him as a sick person, with a rage he could not control, against life, against us, against himself. However, he gave others the impression that he was a righteous and kind man. All the kids in the neighborhood loved him and came to help him with the garden. My mom said, “Your dad likes every family but his.” You didn't work with him in the garden. Never. Because I didn't leave him or because I didn't want to?I didn't want to and he wouldn't let me. Not as a child, especially as a child, I was afraid of him. I started really hating him when I was a teenager. And he hit him, just like Frankie Goldberg in the book — “as driven by the urge to end him once and for all.” Yeah, exactly like in that scene. The novel is full of invented things, but this I wanted to tell literally, and it was very strong to revive those emotions. Like the night he beat me up in front of some cops at a police station. Upon arriving home I felt so much hatred that, if someone had given me a knife, at that time I would have killed him, and maybe I would have killed my mom too for being so passive in front of him. It was terrifying. While I was writing, I didn't see it coming, I got there and it freaked me out. All that anger stored up for years. What was wrong with your father?For my book is not a psychoanalysis work or anything like that, but one can speculate. His rage could come from being trapped in a life he hated, could come from self-hate, could come from being very likely to be homosexual, and at that time an ordinary family father could not leave the closet... There was no love in his life. I didn't see in my life my dad caress my mom, or her caress him, and that my mom was the most tender person in the world. But not with him. Obviously, how could I be tender to a man who insulted her, just like my sister, and who hit her? He created his own hell and didn't have the courage to divorce and let us go. It would have been fair for him to say: “I am creating a toxic family. I'm unhappy. I must go and leave these poor people alone.” At school, like Frankie, he was bullied, too?Not so much. But there was an extreme moment, which I deal with in the novel. When I kissed a girl when I was 13 and on Monday, when I got to school, a supercharismatic, nefarious, misogynistic, believed, and supernarcissistic guy invented that she had said that when I kissed her she felt like a banana eaten by a chango. He made a mockery of the year at school and destroyed my teenage years. A few years ago I learned that he had become a millionaire and presided over Trump's club of followers in Tampa. How long did it take him to get over it?I never dared kiss a girl again. My knees were shaking. I was convinced that it was really ugly and ridiculous, it made me a monster character of Kafka. When I got to college and some woman was blowing my mind, I thought she was setting me up. At first I didn't think I could be attractive. I had a hard time losing that horrible fear. What was I looking for writing Monkey Boy?I wanted to explore my roots and thought that to understand who I was I had to explore the relationship with my father. I thought that my whole life had been to flee from him, that hence the escape from the United States, to immerse myself in Latin America during the Central American wars, to live in Mexico, to marry only Mexicans, that everything was going to be the opposite of my father; but with the book I discovered that I did not run away from him, but that I walked the way to my mother, that I returned to his world, I returned to my mother's nest. Monkey Boy helped me find out that he wasn't my dad's son, but my mom's son. Even living under the shadow of my dad's violence and all her weaknesses, she remained a positive woman, and I identify with her. Besides, my mom was laughing. She and I always laugh a lot. My dad never laughed, he didn't even know how to laugh. “She had a wonderfully jovial laugh, sometimes silly, but my father laughed less. Instead, I sometimes howled and howled like pretending, imitating the happy animals of a barn.” Is there nothing about him in you?Yes, his scepticism towards the privileged people, very Bostonian working class; he mocked the nouveau riche, he did not like the vain. By the relevance of experience in his writing, would you say that he is a realistic writer?Yes and no. Yes in the raw material I use, but what I do are fictional novels, even fantastic. In Monkey Boy from the beginning I play with an illusion of realism, with that character who during a train trip narrates himself his own life almost chronologically. Who would do that? It's not realistic. And the last part is like a ghost tale: I did it with all intent, because I wanted to end up obviously breaking with the fourth wall of realism. And the ghost tale would complete the memory circle, because every memory needs phantom elements to function. Well seen. If you want, put it on and pretend I said it. García Márquez said he was writing to be loved by his friends. You?I write following an impulse that comes from within. And also so that my friends love me. Nothing makes me happier than when what I've written like the writers I admire, like Rachel Kushner, Lauren-Groff, Valeria Luiselli... Nobody does better than them now. The gringo men no longer write good books... or, I don't know, I don't like their books, maybe it's just that, that to my liking the best that has been written in America recently has been written by women. From the old days he loved Saul Bellow, Isaac Bashevis Singer, John Cheever. From Latin America to me, Roberto Bolaño has been important, I admire Alejandro Zambra, Yuri Herrera, César Aira. Although my two contemporary literary icons are Toni Morrison and Natalia Ginzburg, whom I adore as a saint. Why did she? She taught me everything. How he writes and where he comes from. She witnessed horrible things, the Nazis killed her husband, left her widowed with three little children, and writes from there, but without sentimentality, dignity and elegance, putting the traumas in place and at the same time leaving free spaces for creation. It inspires me a lot. After all he's been through in his life, the child abuse, the years of loneliness, the brutality he witnessed in the war, the death of Aura... isn't it a little incredible that he's arrived so well at this point, happy in Mexico City with his wife, Jovi, and his two daughters?Yes, it's very crazy. Sometimes I get the disturbing idea that I'm too happy and that it's something I still don't quite understand and I have to learn to work. But I also have my worries, like money, because with children you feel more pressure to have financial security; or age, I don't like being old, and there are so many books I want to create. No, I think I've finally been able to make good decisions and not always be so self-destructive. It was. Always. How did he manage it?The duel teaches you everything, there is nothing wiser and more instructive than a terrible duel that only you can get out of. And that's where you come out knowing better what you want, what you need and what things to run from. He dedicates the book to four women. Tell me first about your mother, Yolanda Molina. What am I gonna tell you, I loved her like crazy. She's one of my favorite people of all time and the most important of my life, no doubt. Your agent, mythical Amanda Binky Urban. It was key to this book. When I delivered the first draft to the publisher it was over 800 pages long and they were about to leave. They couldn't take me anymore. Besides, there was tension for things they wanted to censor. My agent knew that at that point the novel was a real mess, but I was convinced that there was a good play there, so he pushed me and I remade it until I had a whole new book. What did they want to censor?Things like Frankie's girlfriend wasn't 20 years younger than him or that the gays of the seventies, of the pre-AIDS times, didn't seem so overly uninhibited. Editorials think they're protecting the book from the complicated atmosphere we're in, but my fundamental position is that to write fiction you need total freedom and you don't have to confuse the awkward with the really offensive. I don't want to hurt or offend for free, I don't. So I stand up for what I write and ignore anyone who wants to limit me. That's what I did with my editor's suggestions. She was exemplary: she respected him and, in the end, even gave me the reason. Do you think political correctness harms the quality of literature?I think that in order not to get into trouble I should answer you self-censoring me [laughs]. It is perniciously ubiquitous in certain parts of the literary and university world in the United States. There is a new way of reading with the eagerness of a moral police, and life and people are complex, passionately complex, labyrinthine in their confusions, sometimes thorny or demonic, twisted, harmless or aggressively driven by desire, not always admirable, but sometimes noble in hidden aspects at first sight. Perhaps this is what you want to deal with in your fiction, and there will be many people who do not want to pay attention to such complexities, who are not willing to embrace ambiguities or laugh even uncomfortablely. They read in search of the pleasure of righteous indignation. Look, I think it's cool that someone dedicates their real life, even their writing, to being part of the advance of change, we all want society to progress in every way, and to me, with two little girls, this struggle haunts me; but I don't want political ethics to become a literary duty. Tell me about your daughters. Jojo is 10 years old and she's a beauty, she plays the piano, she's captain of her football team and they just won a championship. Azalea has four and is extraordinary, with an innate sense of humor and self-esteem that Jovi and I don't know where it comes from, because we grew up feeling marginalized, I a child of such insecure suburb and she coming from poverty, the first of her entire family to go to college and, as her father says, the first to cross the border with visa and passport. Jovi is an amazing person. In the last line of The Inner Circuit he wrote: “Jhoana Montes Hernández, mi Jovi, you are the resurrection and the light.” And it's still that, and, besides, my partner in the task of creating a family, the most asshole there is. Hard? Extenuating. How does Aura Estrada remain in her life?She is always present, and her literary values continue to inspire me. She was very talented. I think it's because of her that I've gotten so close to the writers. He says he doesn't want his daughters to grow up in America. Why?Because right now it is a country sunk in hatred, with an economic inequality that is a cancer, where the elites rise more and more, and to others, good luck, and in which it seems that the only important thing is what your identity is; everything is identity, identity of race, of gender, almost nobody speaks of class identity and that a handful of people control everything and the rest is in abandonment. I'm bored with this obsession with identity. This is part of Monkey Boy's narrative fabric. There is a moment when the narrator says “I want to be nothing, why can’t I be nothing?” I've always wanted it. Transcend identity. Yes, I have spent my life, especially as a child, having to explain to people that I am half Jewish and half Catholic, that at home we celebrated Christmas and Chanukah, things like that. Ridiculous! What is being half Catholic, believing in a Christ hanging only from one hand, one leg and half a log? No one's half nothing, you're entirely who you are. End and end. You're 100% Jewish, you're 100% Catholic, whatever you are, and the mania of dividing and tagging and cataloging is... is the fucking other people problem! [the problem of others]. Why did he title the book with a nickname that hurt him so much when he was little?Because it's the perfect title. I like Monkey Boy as a metaphor. It was ambiguous in my case, it could also be taken as something fun or even affectionate. If a black boy is called a monkey, he's going to know that that's racist, it can't be anything else; but someone like me, who is both Guatemalan mestizo-mulato and white Jew, doesn't know for sure if it's racism or if they really think it looks like a monkey. This is the mestizo condition, and many times I have felt that my experience bothers because it does not fit within the current discussions of identity, that I am something like ethnically incorrect and that it is better to pass from people like me. But, honestly, it frees me to have that fragmented identity. With the trilogy that closes Monkey Boy, Francisco Goldman considers his most autobiographical impulse satisfied. He now works on a story that will place in New Bedford, a port south of Boston with a large Guatemalan community and the place where Moby Dick begins, in his opinion the only novel worthy of the qualifier of great American novel. Precisely with a phrase from Melville’s classic he decided to open his last book: “Come on, you, monkey,” a harpooner said.","Francisco Goldman, winner of the Pulitzer Prize in 2011 for his novel Say her name, has just published his third book.",NEU,0.6370952725410461
